asin,title,imgUrl,productURL,stars,reviews,price,listPrice,category_id,isBestSeller,boughtInLastMonth
B014TMV5YE,"Sion Softside Expandable Roller Luggage, Black, Checked-Large 29-Inch",https://m.media-amazon.com/images/I/815dLQKYIYL._AC_UL320_.jpg,https://www.amazon.com/dp/B014TMV5YE,4.5,0,139.99,0,104,FALSE,2000
B07GDLCQXV,Luggage Sets Expandable PC+ABS Durable Suitcase Double Wheels TSA Lock Blue,https://m.media-amazon.com/images/I/81bQlm7vf6L._AC_UL320_.jpg,https://www.amazon.com/dp/B07GDLCQXV,4.5,0,169.99,209.99,104,FALSE,1000
B07XSCCZYG,"Platinum Elite Softside Expandable Checked Luggage, 8 Wheel Spinner Suitcase, TSA Lock, Men and Women, True Navy Blue, Checked Medium 25-Inch",https://m.media-amazon.com/images/I/71EA35zvJBL._AC_UL320_.jpg,https://www.amazon.com/dp/B07XSCCZYG,4.6,0,365.49,429.99,104,FALSE,300
B08MVFKGJM,"Freeform Hardside Expandable with Double Spinner Wheels, Navy, 2-Piece Set (21/28)",https://m.media-amazon.com/images/I/91k6NYLQyIL._AC_UL320_.jpg,https://www.amazon.com/dp/B08MVFKGJM,4.6,0,291.59,354.37,104,FALSE,400
B01DJLKZBA,"Winfield 2 Hardside Expandable Luggage with Spinner Wheels, Checked-Large 28-Inch, Deep Blue",https://m.media-amazon.com/images/I/61NJoaZcP9L._AC_UL320_.jpg,https://www.amazon.com/dp/B01DJLKZBA,4.5,0,174.99,309.99,104,FALSE,400
B07XSCD2R4,"Maxlite 5 Softside Expandable Luggage with 4 Spinner Wheels, Lightweight Suitcase, Men and Women, Sapphire Blue, Carry-On 21-Inch",https://m.media-amazon.com/images/I/61LnBNsSBSL._AC_UL320_.jpg,https://www.amazon.com/dp/B07XSCD2R4,4.5,0,144.49,0,104,FALSE,500
B07MXF4G8K,"Hard Shell Carry on Luggage Airline Approved, Carry on Suitcases with Wheels, Lightweight PC Luminous Textured Travel Luggage, TSA Approved, 20 Inch Small Carry-On, Black",https://m.media-amazon.com/images/I/71CghLYrnAL._AC_UL320_.jpg,https://www.amazon.com/dp/B07MXF4G8K,4.5,0,169.99,0,104,FALSE,400
B07H515VCZ,"Maxporter II 30"" Hardside Spinner Trunk Luggage, Expandable, Navy",https://m.media-amazon.com/images/I/81f3h+YHOXL._AC_UL320_.jpg,https://www.amazon.com/dp/B07H515VCZ,4.5,0,299.99,0,104,FALSE,100
B08BXBCNMQ,"Omni 2 Hardside Expandable Luggage with Spinner Wheels, Checked-Large 28-Inch, Arctic Silver",https://m.media-amazon.com/images/I/91eOWP4mySL._AC_UL320_.jpg,https://www.amazon.com/dp/B08BXBCNMQ,4.5,0,112.63,137.04,104,FALSE,500
B0B9K44XTS,Luggage Sets Expandable Lightweight Suitcases with Wheels PC+ABS Durable Travel Luggage TSA Lock Navy Blue 4pcs,https://m.media-amazon.com/images/I/81dsv5GrCLL._AC_UL320_.jpg,https://www.amazon.com/dp/B0B9K44XTS,4.4,0,209.99,0,104,FALSE,200
B07QZLHTTY,"Crew Versapack Softside Expandable 8 Spinner Wheel Luggage, USB Port, Men and Women, Patriot Blue, Checked Medium 25-Inch",https://m.media-amazon.com/images/I/71py6bRiEwL._AC_UL320_.jpg,https://www.amazon.com/dp/B07QZLHTTY,4.7,0,271.99,319.99,104,FALSE,100
B01HIATG6I,"Chatelet Hard+ Hardside Luggage with Spinner Wheels, Champagne White, Checked-Large 28 Inch, with Brake",https://m.media-amazon.com/images/I/81W+B3pWiQL._AC_UL320_.jpg,https://www.amazon.com/dp/B01HIATG6I,4.6,0,259.6,413.33,104,FALSE,100
B07QXD3J9G,"Crew Versapack Softside Expandable 8 Spinner Wheel Luggage, USB Port, Men and Women, Jet Black, Carry on 20-Inch",https://m.media-amazon.com/images/I/71tFi58LKwL._AC_UL320_.jpg,https://www.amazon.com/dp/B07QXD3J9G,4.5,0,323.99,0,104,FALSE,100
B081JDHNX1,"Centric 2 Hardside Expandable Luggage with Spinners, True Navy, 3-Piece Set (20/24/28)",https://m.media-amazon.com/images/I/81UXQZdNZzL._AC_UL320_.jpg,https://www.amazon.com/dp/B081JDHNX1,4.5,0,399.92,699.97,104,FALSE,100
B07DMBG7CX,Xpedition 30 Inch Multi-Pocket Upright Rolling Duffel Bag,https://m.media-amazon.com/images/I/81QKjgbsq4L._AC_UL320_.jpg,https://www.amazon.com/dp/B07DMBG7CX,4.3,0,42,0,104,FALSE,300
B0B2X1BDFH,"Stratum 2.0 Expandable Hardside Luggage with Spinner Wheels, 28"" SPINNER, Slate Blue",https://m.media-amazon.com/images/I/91qkFv-txyL._AC_UL320_.jpg,https://www.amazon.com/dp/B0B2X1BDFH,4.5,0,89.95,139.99,104,FALSE,300
B00GI3572E,"Women's Spinner Mobile Office, Black, One Size",https://m.media-amazon.com/images/I/91qdE638dxL._AC_UL320_.jpg,https://www.amazon.com/dp/B00GI3572E,4.6,0,164.99,174.99,104,FALSE,200
B084P184MG,"Ascella X Softside Expandable Luggage with Spinners, Black, Checked-Large 29-Inch",https://m.media-amazon.com/images/I/910PxQKAThL._AC_UL320_.jpg,https://www.amazon.com/dp/B084P184MG,4.5,0,198.41,209.99,104,FALSE,100
B094LVRCZD,"Boren Polycarbonate Hardside Rugged Travel Suitcase Luggage with 8 Spinner Wheels, Aluminum Handle, Black, Checked-Large 30-Inch",https://m.media-amazon.com/images/I/611EC7sEWMS._AC_UL320_.jpg,https://www.amazon.com/dp/B094LVRCZD,3.9,0,99.99,0,104,FALSE,300
B072Z7K96L,Clear PVC Suitcase Cover Protectors 28 Inch Luggage Cover for Wheeled Suitcase (28''(24.80''H x 19.90''L x 12.40''W)),https://m.media-amazon.com/images/I/71TXWZwZ1+L._AC_UL320_.jpg,https://www.amazon.com/dp/B072Z7K96L,4.2,0,17.99,19.99,104,FALSE,1000
B09WXLYG6C,"Aspire DLX Softside Expandable Luggage with Spinner Wheels, Checked-Medium 25-Inch, Emerald",https://m.media-amazon.com/images/I/81CSqVSqRqL._AC_UL320_.jpg,https://www.amazon.com/dp/B09WXLYG6C,4.6,0,130.29,159.99,104,FALSE,200
B07RJTLT1B,Soft Baseball Cap Tiger Cross-Stitch Embroidery Wild Animals Cotton Dad Hats for Men & Women,https://m.media-amazon.com/images/I/51vHIR97SQL._AC_UL320_.jpg,https://www.amazon.com/dp/B07RJTLT1B,4.5,0,23.99,0,112,FALSE,0
B086WRLZX6,Mens Rimless Square Silver Frame Purple Tint Hip Hop Fashion Sunglasses,https://m.media-amazon.com/images/I/51jxhpSzg9L._AC_UL320_.jpg,https://www.amazon.com/dp/B086WRLZX6,3.9,0,17.99,0,112,FALSE,0
B096JSMNDC,"Neck Gaiter Mask UPF 50 Sun Protection for Men & Women, Fishing, Hiking, Outdoor",https://m.media-amazon.com/images/I/61phJO58ZUS._AC_UL320_.jpg,https://www.amazon.com/dp/B096JSMNDC,4.4,0,9.98,0,112,FALSE,50
B07N666MYT,Longfin Elite Sunglasses,https://m.media-amazon.com/images/I/618zOWiIipL._AC_UL320_.jpg,https://www.amazon.com/dp/B07N666MYT,4.6,0,119,0,112,FALSE,0
B0C42HJZF7,"Mens Gifts for Husband, Husband Gifts from Wife - Mens Metal Money Clip 3.4""x2.1"" - Personalized Birthday Gifts for Him Husband, Unique Anniversary Christmas Valentines Day Gifts for Him Husband",https://m.media-amazon.com/images/I/81qZUS07hyL._AC_UL320_.jpg,https://www.amazon.com/dp/B0C42HJZF7,4.6,0,15.99,17.99,112,FALSE,0
B09C1DYQXD,"Baseball Caps for Men Women,Embroidered Women Want Me Fish Fear Me Adjustable Trucker Hat Cotton Unisex Dad Hats",https://m.media-amazon.com/images/I/81FY29wXR6L._AC_UL320_.jpg,https://www.amazon.com/dp/B09C1DYQXD,4.8,0,16.99,0,112,FALSE,0
B08HRG7PKW,Embroidered Spacex Hat Baseball Hats for Men and Women Black,https://m.media-amazon.com/images/I/81fNVt8OMYL._AC_UL320_.jpg,https://www.amazon.com/dp/B08HRG7PKW,4.2,0,16.99,0,112,FALSE,0
B0BRRGSF53,"3D Embroidered Grandpa Est. 2023 Hat, Distressed Cotton Adjustable Funny Best Grandfather Baseball Cap",https://m.media-amazon.com/images/I/618zcnDCd3L._AC_UL320_.jpg,https://www.amazon.com/dp/B0BRRGSF53,4.7,0,19.99,0,112,FALSE,0
B079ZXFD15,Southwestern Patterns Hiker Belt Nylon,https://m.media-amazon.com/images/I/71FxeOA+ZsL._AC_UL320_.jpg,https://www.amazon.com/dp/B079ZXFD15,4.3,0,24.95,0,112,FALSE,0
B07JFRF712,Replacement Lenses & Sock Kit for Oakley Flak Jacket XLJ Sunglass,https://m.media-amazon.com/images/I/61S8uEIftHL._AC_UL320_.jpg,https://www.amazon.com/dp/B07JFRF712,4.2,0,24.99,0,112,FALSE,0
B078NYJ17L,Rubbery Duck Necktie - Barney's Ducky Tie,https://m.media-amazon.com/images/I/610+pjIxU8L._AC_UL320_.jpg,https://www.amazon.com/dp/B078NYJ17L,4.8,0,9.99,0,112,FALSE,50
B07SLMXR3L,Trucker Hat Baseball Cap Paramedic A Embroidery Dad Hats for Men Snaps One Size,https://m.media-amazon.com/images/I/61PbPNMKRPL._AC_UL320_.jpg,https://www.amazon.com/dp/B07SLMXR3L,4.6,0,23.99,0,112,FALSE,0
B07HGKD78Z,Czar Whitewall - HD Plus Gry Green W/Platinum Spectra Mirror,https://m.media-amazon.com/images/I/61a6N2rpC9L._AC_UL320_.jpg,https://www.amazon.com/dp/B07HGKD78Z,4.5,0,99.29,104.08,112,FALSE,0
B07KCXK8PY,BowTie Lavender Purple Color Paisley Mens Bow Tie & Handkerchief,https://m.media-amazon.com/images/I/81rZ1w83hAL._AC_UL320_.jpg,https://www.amazon.com/dp/B07KCXK8PY,4.6,0,9.99,0,112,FALSE,0
B09JSYFPSK,3 Hole Uzi Balaclava Knitted Full Face Cover Ski Mask Winter Windproof Neck Warmer Thermal Cycling for Men Women,https://m.media-amazon.com/images/I/61+tCzu2VDL._AC_UL320_.jpg,https://www.amazon.com/dp/B09JSYFPSK,4.2,0,11.99,0,112,FALSE,0
B0787SPDHJ,Men's Fashion Suspenders - The Glitter Collection (Silver),https://m.media-amazon.com/images/I/813Sa-6asYL._AC_UL320_.jpg,https://www.amazon.com/dp/B0787SPDHJ,4.2,0,9.99,0,112,FALSE,0
B01KIY9JT0,Trainer Red Poke Monster Embroidered Mesh Cap,https://m.media-amazon.com/images/I/516-JBMxMnL._AC_UL320_.jpg,https://www.amazon.com/dp/B01KIY9JT0,4.6,0,20.49,0,112,FALSE,0
B01LYE3FYR,Sartorial Black Leather Key Fob Loop 114627,https://m.media-amazon.com/images/I/61kqkITXXXL._AC_UL320_.jpg,https://www.amazon.com/dp/B01LYE3FYR,4.7,0,195.98,0,112,FALSE,0
B07Q52GWPW,"Plånbok Floating Waterproof Wallet | Perfect for Boating, Kayaking and Other Outdoor Activities | Bifold Black",https://m.media-amazon.com/images/I/A1uYlm7MGeL._AC_UL320_.jpg,https://www.amazon.com/dp/B07Q52GWPW,4.1,0,25.95,0,112,FALSE,0
B0CBCB4C2F,"Winter Gloves for Men Women - 2 Packs Mens Gloves Black Gloves Men, Gloves for Men Cold Weather Heated Anti-Slip Touch Screen with Thermal Soft Knit, Mens Winter Gloves for Running, Driving and Hiking",https://m.media-amazon.com/images/I/71Qx7Nmy-5L._AC_UL320_.jpg,https://www.amazon.com/dp/B0CBCB4C2F,0,0,7.99,9.99,112,FALSE,0
B00CEL3BJU,Barbarian Vagabond Beanie - Original Handmade Knit Hat and Removable Beard,https://m.media-amazon.com/images/I/71MF9IqVZ8L._AC_UL320_.jpg,https://www.amazon.com/dp/B00CEL3BJU,4.5,0,27.99,0,112,FALSE,0
B07GLCXNDH,Polarized Clip on Sunglasses Over Prescription Glasses Anti-Glare UV400 for Men Women Driving Travelling Outdoor,https://m.media-amazon.com/images/I/51zcwVeCakL._AC_UL320_.jpg,https://www.amazon.com/dp/B07GLCXNDH,4,0,10.99,0,112,FALSE,50
B07V3DVQNS,"Gorilla Playsets 04-0037-G Dual Ride Glider Back-to-Back Tandem Swing, Green, Green Plastic Coated Chains, Multi-Child Swing",https://m.media-amazon.com/images/I/81ZFo1+0RwL._AC_UL320_.jpg,https://www.amazon.com/dp/B07V3DVQNS,4.6,525,93.99,120.99,228,FALSE,300
B071SC9QYG,Little Valentine 100-Round Refill Pack for Nerf Rival,https://m.media-amazon.com/images/I/71qnxYXGbgL._AC_UL320_.jpg,https://www.amazon.com/dp/B071SC9QYG,4.7,6377,12.99,0,228,FALSE,300
B09MLTBLV3,"Bennol Sand and Water Table, 4 in 1 Outdoor Sand Water Play Table Beach Toys for Toddlers Kids Boys Girls, Outdoor Activity Summer Toys for Toddlers Age 1-3 3-5",https://m.media-amazon.com/images/I/71NOikA5lVL._AC_UL320_.jpg,https://www.amazon.com/dp/B09MLTBLV3,2.7,474,29.99,34.99,228,FALSE,400
B0037TSTUO,"Swimline Doodles Inflatable Pool Noodle Float, 6 Count",https://m.media-amazon.com/images/I/71XuU+l8qzL._AC_UL320_.jpg,https://www.amazon.com/dp/B0037TSTUO,4,1416,13.58,14.99,228,FALSE,300
B06XYTX23H,6 Pack Mini Foam Dart-Firing Blasters Micro Toy Guns with 36 Darts - Multi Pack Nerf Compatible Bulk Party Favors Supplies for Kids,https://m.media-amazon.com/images/I/71zXES8OJ1L._AC_UL320_.jpg,https://www.amazon.com/dp/B06XYTX23H,4.3,2935,11.99,0,228,FALSE,200
B09YTV3111,"Springflower 24 Pcs Bubble Bottles with Wand,Bubbles Party Favors for Kids,Summer Toys, Blow Bubbles Solution Novelty Toy, Party Favors, Birthday Party Supplies, Outdoor & Indoor Activity,4oz,6 Colors",https://m.media-amazon.com/images/I/81mmcjv6f-L._AC_UL320_.jpg,https://www.amazon.com/dp/B09YTV3111,4.5,2128,27.99,0,228,FALSE,200
B09M3N768J,"MITCIEN Kids Camping Set with Campfire, Play Tent , Binoculars, Oil Lantern, Toddlers Pretend Cutting Fruits, Marshmallow, Camping Toys Play Set for Boys Girls 3-5 Year Old and Up Indoor Outdoor Toys",https://m.media-amazon.com/images/I/71uiEuaWrhL._AC_UL320_.jpg,https://www.amazon.com/dp/B09M3N768J,4.7,496,35.99,0,228,FALSE,200
B087KSXB1P,"Toy To Enjoy Outdoor Dinosaur Chair for Kids – Foldable Children’s Chair for Camping, Tailgates, Beach, – Carrying Bag Included Mesh Cup Holder & Sturdy Construction. Ages 5 to 10 (Patent Pending)",https://m.media-amazon.com/images/I/91QkfFtwxVL._AC_UL320_.jpg,https://www.amazon.com/dp/B087KSXB1P,4.8,2425,34.99,49.99,228,FALSE,200
B0B5MYRCWN,"2 Pcs Hover Soccer Toys Set, Boys Gift Idea for Age 6 7 8 9 10 11 12 Years Old, Teen Boys World Cup Christmas Easter Stuffers Valentine Holiday Birthday Present Ball Toy",https://m.media-amazon.com/images/I/81Y6nJ3r-UL._AC_UL320_.jpg,https://www.amazon.com/dp/B0B5MYRCWN,4.2,205,15.29,16.99,228,FALSE,200
B07GY9PF2D,Trekassy 750 lb Spider Web Saucer Swing 40 inch for Tree Kids with Steel Frame and 2 Hanging Straps,https://m.media-amazon.com/images/I/71A+biTwfdL._AC_UL320_.jpg,https://www.amazon.com/dp/B07GY9PF2D,4.7,2390,79.99,99.99,228,FALSE,300
B07MCQN1SQ,"E-Know Bubble Wand,3 Style Giant Bubble Wand Outdoor Toy for Kids, Recyclable Stainless Steel,Telescopic Design Bubble Party Favors, Works Best Bubbleventi Bubble Mix",https://m.media-amazon.com/images/I/61x3H7CSR3L._AC_UL320_.jpg,https://www.amazon.com/dp/B07MCQN1SQ,4.3,1320,14.99,0,228,FALSE,300
B08NFQYDSW,"MAGICYOYO Responsive Yoyo for Beginners K2, Dual Purpose Yoyo for Kids with Replacement Unresponsive Bearing for Intermediate + Bearing Remover + Yoyo Case Bag + 12 Yoyo Strings (Blue)",https://m.media-amazon.com/images/I/71aWFVQSyxL._AC_UL320_.jpg,https://www.amazon.com/dp/B08NFQYDSW,4.4,299,13.99,0,228,FALSE,200
B0C4Y55Z9D,"79in Large Inflatble Blue Shark for Pool, Party Decoration, Supplies Favors, Birthday Gifts for Kids and Adults",https://m.media-amazon.com/images/I/71+9hVFiXYL._AC_UL320_.jpg,https://www.amazon.com/dp/B0C4Y55Z9D,4.7,13,22.69,26.99,228,FALSE,200
B08FMNRY22,Baby Baseball Toy | Ideal Toy at 12 Months | My First Baseball bat | Inspire and Play | Extra Sensory Features for Babies | Part of The LITTLE SPORT STAR Collection for Babies,https://m.media-amazon.com/images/I/71ONAlFHCiL._AC_UL320_.jpg,https://www.amazon.com/dp/B08FMNRY22,4.8,368,22.99,0,228,FALSE,200
B0C7HK2XC3,Pippin&Co Baby Ball Pit with 250 Balls + Storage Bag - Soft Memory Foam Ball Pit with Washable Velvet Cover - Ball Pits for Toddlers 1-3 and Kids Ball Pit for Indoor/Outdoor Use.,https://m.media-amazon.com/images/I/71hD3wzeRKL._AC_UL320_.jpg,https://www.amazon.com/dp/B0C7HK2XC3,4.5,11,89.95,0,228,FALSE,200
B0BCHSYL34,"2 Packs Flying Orb Ball Toy, Hover Ball Cosmic Globe Cool Stuff with Control Switch, Galactic Fidget Spinner Boomerang Ball Gifts for 6 7 8 9 10 11 12+ Year Old Kids Boys Girls Adults(Red&Blue)",https://m.media-amazon.com/images/I/81DyI8bsGgL._AC_UL320_.jpg,https://www.amazon.com/dp/B0BCHSYL34,3.9,852,35.99,0,228,FALSE,200
B097TSNZLF,"Bankers Box at Play Halloween Playhouse, Cardboard Playhouse and Craft Activity for Kids",https://m.media-amazon.com/images/I/81Jk40SHs4S._AC_UL320_.jpg,https://www.amazon.com/dp/B097TSNZLF,4.6,136,39.99,0,228,FALSE,100
B00JLKRD8C,Aurora® Cuddly Lion Stuffed Animal - Cozy Comfort - Endless Snuggles - Brown 14 Inches,https://m.media-amazon.com/images/I/91xXJX8hPqL._AC_UL320_.jpg,https://www.amazon.com/dp/B00JLKRD8C,4.8,967,19.98,0,228,FALSE,200
B08F2TR9B5,"Kiddzery Tunnel and Ball Pit Play Tent | 5pc Toddler Jungle Gym Tunnels to Crawl Through with Tents for Kids, Toddlers, Infants Boys & Girls | Indoors & Outdoors Gift | Target Game with 4 Dart Balls",https://m.media-amazon.com/images/I/81s9NkisgXL._AC_UL320_.jpg,https://www.amazon.com/dp/B08F2TR9B5,4.5,965,59.92,89.49,228,FALSE,300
B0932ZFCT6,Max Fun Pool Floats Toys Games Set - Floating Basketball Hoop Inflatable Cross Ring Toss Game Toys for Kids Adults Swimming Pool Water Game,https://m.media-amazon.com/images/I/81hrr4oFK5S._AC_UL320_.jpg,https://www.amazon.com/dp/B0932ZFCT6,3.7,1122,23.99,0,228,FALSE,400
B07F1SHF7N,"E-KNOW Bubble Wand,Stainless Steel Giant Bubble Wand Outdoor Toy for Kids Telescopic Design, Bubble Toys for Party, Works Best Bubbleventi Bubble Mix",https://m.media-amazon.com/images/I/71PmMjJWKFL._AC_UL320_.jpg,https://www.amazon.com/dp/B07F1SHF7N,4.4,1279,11.98,0,228,FALSE,200
B07J6S6LC3,"Cyfie Bath Toys Toddler, Bathtub Basketball Hoop for Kids Girls Boys Toy, Indoor Basketball Hoops Fun Game Bath Toys Playset with 3 Soft Balls for Bedroom Bathroom Office",https://m.media-amazon.com/images/I/618nAOmBefL._AC_UL320_.jpg,https://www.amazon.com/dp/B07J6S6LC3,3.9,4441,9.7,0,228,FALSE,300
B0BSG74M3W,"Xcello Sports Kickball Set - 10"" Playground Ball, Throw Down Bases, Foul Marker Discs, 12"" Pump and Scoreboard",https://m.media-amazon.com/images/I/71mTV5jKQ7L._AC_UL320_.jpg,https://www.amazon.com/dp/B0BSG74M3W,4.8,38,49.95,0,228,FALSE,200
B0CCY9SQRT,"Gddochn 300 Pack Colorful Glass Marbles,Marbles Bulk Assorted Colors Glass Marbles for Marble Games,Kids,DIY and Home Decoration",https://m.media-amazon.com/images/I/81j5vawNBIL._AC_UL320_.jpg,https://www.amazon.com/dp/B0CCY9SQRT,0,0,13.99,0,228,FALSE,50
B00591FOQK,Intex My Baby Float,https://m.media-amazon.com/images/I/71G-umUVpTL._AC_UL320_.jpg,https://www.amazon.com/dp/B00591FOQK,4.5,5290,6.99,10.25,228,FALSE,200
B0BZ89R4WL,Bubble Machine for Kids | Outdoor Toys for Toddlers Age 3-5 | Perfect as a Gift for Party Favors Birthdays Valentine Halloween and Christmas | Battery Operated Bubble Wand for Easy Outdoor Use,https://m.media-amazon.com/images/I/710o2wqJerL._AC_UL320_.jpg,https://www.amazon.com/dp/B0BZ89R4WL,4,68,12.99,0,228,FALSE,300
B08HZF6V5X,Kaufam Gun Toy Gift for Boys Age of 4 5 6 7 8 9 10 10+ Years Old Kids Girls for Birthday with Moving Shooting Target 2 Blaster Gun and 18 Foam Balls Compatible with Nerf Guns,https://m.media-amazon.com/images/I/71o+vfpWEKL._AC_UL320_.jpg,https://www.amazon.com/dp/B08HZF6V5X,4.5,2388,39.98,59.99,228,FALSE,200
B0BMJL12QY,"Delta Children Tree Bookcase - Greenguard Gold Certified, Fern Green/Crafted Natural",https://m.media-amazon.com/images/I/71S4hs-UuJL._AC_UL320_.jpg,https://www.amazon.com/dp/B0BMJL12QY,4.7,72,200.44,0,124,FALSE,200
B0B3J84WDV,"Auksay Animal Net or Hammock with Star Light, Triangle Hanging Net,Stuffed Storage Stand with Hooks,Hanging Net for Kids Room Decoration Girl Plush Toys-White",https://m.media-amazon.com/images/I/71MGYaUV0TL._AC_UL320_.jpg,https://www.amazon.com/dp/B0B3J84WDV,4.8,135,16.99,0,124,FALSE,200
B00C18NV8C,"Guidecraft Classic Kitchen Helper® Stool - White with 2 Keepers and Non-Slip Mat: Foldable, Adjustable Height Safety Cooking Tower for Toddlers with Chalkboard and Whiteboard Message Boards",https://m.media-amazon.com/images/I/818dQEqOOGL._AC_UL320_.jpg,https://www.amazon.com/dp/B00C18NV8C,4.7,3433,199.95,0,124,FALSE,100
B0C3V7NXZP,"ILPEOD Toddler Chair Sherpa Couch Kids Plush Chair Sherpa Kids Chairs, Cuddly Toddler Plush Chair Toddler Couch Reading Chair for Kids Fuzzy Baby Chair Grey",https://m.media-amazon.com/images/I/71r1TdzwMML._AC_UL320_.jpg,https://www.amazon.com/dp/B0C3V7NXZP,5,12,67.59,0,124,FALSE,100
B01GVVQNL6,"Adjustable Height Active Learning Stool - Padded Office Desk Chair with Rocking, Wobble, Tilting Motion - Black",https://m.media-amazon.com/images/I/61Mwo+W2UDL._AC_UL320_.jpg,https://www.amazon.com/dp/B01GVVQNL6,4.3,1224,171.02,189.69,124,FALSE,200
B0B3XFGT2P,"Extra Large Toy Box Chest for Boys Girls, Collapsible Sturdy Kids Storage Bins with Flip-Top Lid & Handles,Large Toy Box Chest Storage Organizer for Nursery,Playroom,Closet,Office 40.6""x14""x16.5""",https://m.media-amazon.com/images/I/813LU7f6GVL._AC_UL320_.jpg,https://www.amazon.com/dp/B0B3XFGT2P,4.5,314,44.99,0,124,FALSE,200
B0BVLZ5TTQ,"Jute Rope Laundry Hamper Basket, 58L Tall Laundry Basket for Blanket Storage, Large Baby Nursery Hamper for Laundry, Woven Clothes Hamper for Bedroom, Living Room",https://m.media-amazon.com/images/I/81hzD-ko1bL._AC_UL320_.jpg,https://www.amazon.com/dp/B0BVLZ5TTQ,4.4,241,27.99,0,124,FALSE,100
B07S2PBXZP,"Costzon Kids Table and Chair Set, 3 Piece Activity Table w/Detachable Toy Storage Bins & 2 Chairs for Children Reading Art Craft, Strong Bearing Capacity, Lightweight, Toddler Table & Chair Set, Green",https://m.media-amazon.com/images/I/51vckX3nIlL._AC_UL320_.jpg,https://www.amazon.com/dp/B07S2PBXZP,4.7,2108,105.98,0,124,FALSE,100
B00F3JZY1S,"Handy Laundry Jumbo Toy Hammock, Organize Stuffed Animals or Children's Toys, Looks Great with Any Decor While neatly organizing Kid's Toys and Stuffed Animals, Expands to 5.5 feet, White",https://m.media-amazon.com/images/I/81bEsMfLGCL._AC_UL320_.jpg,https://www.amazon.com/dp/B00F3JZY1S,4.3,18443,6.99,8.44,124,FALSE,100
B09F5SVYLJ,Ulax Furniture Kids Fold Out Couch 2-in-1 Children Convertible Sofa to Lounger with Soft Plush Fabric (Navy Dinosaur),https://m.media-amazon.com/images/I/81Ni8n78u7L._AC_UL320_.jpg,https://www.amazon.com/dp/B09F5SVYLJ,4.5,426,64.95,0,124,FALSE,100
B0B3XGMZ8R,"HomeMarvel Large Toy Box, Kids Toy Box with Flip-top Lid, Foldable Toy Box Chest Storage Bin for Boys,Girl, Playroom, Bedroom, Nursery, Closet, 40.6 x14.2 x16.5inch",https://m.media-amazon.com/images/I/81P6M0tDBTL._AC_UL320_.jpg,https://www.amazon.com/dp/B0B3XGMZ8R,4.5,367,44.99,0,124,FALSE,200
B007BO5OAY,"Lay-n-Go 2-in-1 Portable Drawstring Toys Storage Organizer and Play Mat for Room and Travel, Made for Kids and Toddlers with a Durable Patented Design",https://m.media-amazon.com/images/I/71clRplBlUL._AC_UL320_.jpg,https://www.amazon.com/dp/B007BO5OAY,4.7,441,49.95,0,124,FALSE,100
B07L39W5JJ,"Delta Children Upholstered Twin Bed, Marvel Spider-Man-",https://m.media-amazon.com/images/I/81tN+cnJNNL._AC_UL320_.jpg,https://www.amazon.com/dp/B07L39W5JJ,4.6,1280,192.93,259.99,124,FALSE,100
B00BH0RJCE,"ECR4Kids 2-Shelf Mobile Storage Cabinet, Classroom Furniture, Natural",https://m.media-amazon.com/images/I/711JTpu7wSL._AC_UL320_.jpg,https://www.amazon.com/dp/B00BH0RJCE,4.6,394,169.99,0,124,FALSE,100
B09FLFGQF1,"Costzon Toy Storage Organizer for Kids, 5-Section School Classroom Storage Cabinet for Organizing Books Toys, Wooden Bookshelf Daycare Furniture for Playroom, Kids Room, Nursery, Kindergarten (White)",https://m.media-amazon.com/images/I/71W5yIo6a7L._AC_UL320_.jpg,https://www.amazon.com/dp/B09FLFGQF1,4.5,285,0,0,124,FALSE,100
B072KDDS51,"Ollieroo Metal Folding Step Stool, Wide One Step Stool with Non Slip Rubber Platform, 7 inch One Step Ladder, Max Load 330 lbs for Adults Kids, Portable Foot Stool for Kitchen Bedroom（Grey）",https://m.media-amazon.com/images/I/51cDECTmX6L._AC_UL320_.jpg,https://www.amazon.com/dp/B072KDDS51,4.6,4602,23.99,34.99,124,FALSE,100
B0B5JW8MN1,"CONSDAN Step Stool with Metal Frame, Solid Hardwood Step Stool for Toddler/Kids/Adult, Portable Step Stool for Bedroom Bathroom-Black",https://m.media-amazon.com/images/I/71G3PaF2BFL._AC_UL320_.jpg,https://www.amazon.com/dp/B0B5JW8MN1,4.5,49,29.74,0,124,FALSE,100
B08GL46BST,Disney Frozen 2 Kids Camp Chair Foldable Chair with Carry Bag,https://m.media-amazon.com/images/I/81FA9qFZ1rL._AC_UL320_.jpg,https://www.amazon.com/dp/B08GL46BST,4.5,563,0,0,124,FALSE,200
